<?xml version="1.0"?>
<!DOCTYPE DatabaseInventory SYSTEM "BD.dtd">
<DatabaseInventory>
  <DatabaseName>
    <GlobalDatabaseName>production.iDevelopment.info</GlobalDatabaseName>
    <OracleSID>production</OracleSID>
    <DatabaseDomain>iDevelopment.info</DatabaseDomain>
    <Administrator EmailAlias="jhunter" Extension="6007">Jeffrey Hunter</Administrator>
    <DatabaseAttributes Type="Production" Version="9i"/>
    <Comments>
      The following database should be considered the most stable for up-to-date data. The backup strategy includes running the database in Archive Log Mode and performing nightly backups. All new accounts need to be approved by the DBA Group before being created.
    </Comments>
  </DatabaseName>
  <DatabaseName>
    <GlobalDatabaseName>development.iDevelopment.info</GlobalDatabaseName>
    <OracleSID>development</OracleSID>
    <DatabaseDomain>iDevelopment.info</DatabaseDomain>
    <Administrator EmailAlias="jhunter" Extension="6007">Jeffrey Hunter</Administrator>
    <Administrator EmailAlias="mhunter" Extension="6008">Melody Hunter</Administrator>
    <DatabaseAttributes Type="Development" Version="9i"/>
    <Comments>
      The following database should contain all hosted applications. Production
      data will be exported on a weekly basis to ensure all development environments
      have stable and current data.
    </Comments>
  </DatabaseName>
  <DatabaseName>
    <GlobalDatabaseName>testing.iDevelopment.info</GlobalDatabaseName>
    <OracleSID>testing</OracleSID>
    <DatabaseDomain>iDevelopment.info</DatabaseDomain>
    <Administrator EmailAlias="jhunter" Extension="6007">Jeffrey Hunter</Administrator>
    <Administrator EmailAlias="mhunter" Extension="6008">Melody Hunter</Administrator>
    <Administrator EmailAlias="ahunter">Alex Hunter</Administrator>
    <DatabaseAttributes Type="Testing" Version="9i"/>
    <Comments>
      The following database will host more than half of the testing for our hosting environment.
    </Comments>
  </DatabaseName>
</DatabaseInventory>